{
  "$schema": "./agency-source-policy.schema.json",
  "schemaVersion": 1,
  "reviewedAt": "2026-09-26",
  "rights": [
    {
      "state": "AL",
      "role": "parks",
      "url": "https://conservationgis.alabama.gov/adcnrweb/rest/services/DCNRTrails/MapServer/0",
      "status": "Unconfirmed",
      "evidence": "docs/archive/reports/STATE_AGENCY_REDISTRIBUTION_RIGHTS_2026-09-26.md"
    },
    {
      "state": "AL",
      "role": "forestry",
      "url": "https://gis.forestry.alabama.gov/arcgis/rest/services/Hosted/StateLandTrail/FeatureServer/0",
      "status": "Unconfirmed",
      "evidence": "docs/archive/reports/STATE_AGENCY_REDISTRIBUTION_RIGHTS_2026-09-26.md"
    },
    {
      "state": "AK",
      "role": "parks",
      "url": "https://arcgis.dnr.alaska.gov/arcgis/rest/services/DPOR/Park_Boundary_Facility/FeatureServer",
      "status": "Unconfirmed",
      "evidence": "docs/archive/reports/STATE_AGENCY_REDISTRIBUTION_RIGHTS_2026-09-26.md"
    },
    {
      "state": "AK",
      "role": "forestry",
      "url": "https://services1.arcgis.com/7HDiw78fcUiM2BWn/ArcGIS/rest/services/State_Forest_Boundary_Public_View_2/FeatureServer/0",
      "status": "Unconfirmed",
      "evidence": "docs/archive/reports/STATE_AGENCY_REDISTRIBUTION_RIGHTS_2026-09-26.md"
    },
    {
      "state": "AZ",
      "role": "parks",
      "url": "https://services7.arcgis.com/EQeZILY2rwa3o0JM/arcgis/rest/services/2022_11_22_Statewide_Trails/FeatureServer/0",
      "status": "Unconfirmed",
      "evidence": "docs/archive/reports/STATE_AGENCY_REDISTRIBUTION_RIGHTS_2026-09-26.md"
    },
    {
      "state": "AZ",
      "role": "forestry",
      "url": "https://gis-dffm.hub.arcgis.com/",
      "status": "Lead only",
      "evidence": "docs/archive/reports/STATE_AGENCY_REDISTRIBUTION_RIGHTS_2026-09-26.md"
    },
    {
      "state": "AR",
      "role": "parks",
      "url": "https://gis.ardot.gov/hosting/rest/services/Hosted/StateParks/FeatureServer/0",
      "status": "Unconfirmed",
      "evidence": "docs/archive/reports/STATE_AGENCY_REDISTRIBUTION_RIGHTS_2026-09-26.md"
    },
    {
      "state": "AR",
      "role": "parks supplement",
      "url": "https://gis.arkansas.gov/arcgis/rest/services/FEATURESERVICES/Environment/FeatureServer/22",
      "status": "Unconfirmed",
      "evidence": "docs/archive/reports/STATE_AGENCY_REDISTRIBUTION_RIGHTS_2026-09-26.md"
    },
    {
      "state": "AR",
      "role": "parks supplement",
      "url": "https://gis.arkansas.gov/arcgis/rest/services/FEATURESERVICES/Location/FeatureServer/24",
      "status": "Supported",
      "evidence": "docs/archive/reports/STATE_AGENCY_REDISTRIBUTION_RIGHTS_2026-09-26.md"
    },
    {
      "state": "AR",
      "role": "forestry",
      "url": "https://gis.arkansas.gov/arcgis/rest/services/FEATURESERVICES/Location/FeatureServer/24",
      "status": "Supported",
      "evidence": "docs/archive/reports/STATE_AGENCY_REDISTRIBUTION_RIGHTS_2026-09-26.md"
    },
    {
      "state": "AR",
      "role": "forestry supplement",
      "url": "https://gis.arkansas.gov/arcgis/rest/services/FEATURESERVICES/Environment/FeatureServer/22",
      "status": "Unconfirmed",
      "evidence": "docs/archive/reports/STATE_AGENCY_REDISTRIBUTION_RIGHTS_2026-09-26.md"
    },
    {
      "state": "CA",
      "role": "parks",
      "url": "https://www.parks.ca.gov/?page_id=29682",
      "status": "Restricted",
      "evidence": "docs/archive/reports/STATE_AGENCY_REDISTRIBUTION_RIGHTS_2026-09-26.md"
    },
    {
      "state": "CA",
      "role": "forestry",
      "url": "https://34c031f8-c9fd-4018-8c5a-4159cdff6b0d-cdn-endpoint.azureedge.net/-/media/calfire-website/what-we-do/fire-resource-assessment-program---frap/gis-data/stateforests241gdb.zip?hash=993C3D06E549F0308BF78E026D3F3655&rev=0f5f76e0dcd447bd9eee2395eba3c13b",
      "status": "Supported",
      "evidence": "docs/archive/reports/STATE_AGENCY_REDISTRIBUTION_RIGHTS_2026-09-26.md"
    },
    {
      "state": "CO",
      "role": "parks",
      "url": "https://data.colorado.gov/Recreation/Trails-in-Colorado-State-Parks/qqnv-7jrr",
      "status": "Supported",
      "evidence": "docs/archive/reports/STATE_AGENCY_REDISTRIBUTION_RIGHTS_2026-09-26.md"
    },
    {
      "state": "CO",
      "role": "parks supplement",
      "url": "https://services5.arcgis.com/ttNGmDvKQA7oeDQ3/ArcGIS/rest/services/CPWAdminData/FeatureServer/2",
      "status": "Unconfirmed",
      "evidence": "docs/archive/reports/STATE_AGENCY_REDISTRIBUTION_RIGHTS_2026-09-26.md"
    },
    {
      "state": "CO",
      "role": "forestry",
      "url": "https://services5.arcgis.com/ttNGmDvKQA7oeDQ3/ArcGIS/rest/services/CPWAdminData/FeatureServer/5",
      "status": "Unconfirmed",
      "evidence": "docs/archive/reports/STATE_AGENCY_REDISTRIBUTION_RIGHTS_2026-09-26.md"
    },
    {
      "state": "CT",
      "role": "parks",
      "url": "https://services1.arcgis.com/FjPcSmEFuDYlIdKC/arcgis/rest/services/Connecticut_DEEP_Property/FeatureServer/0",
      "status": "Supported",
      "evidence": "docs/archive/reports/STATE_AGENCY_REDISTRIBUTION_RIGHTS_2026-09-26.md"
    },
    {
      "state": "CT",
      "role": "parks supplement",
      "url": "https://services1.arcgis.com/FjPcSmEFuDYlIdKC/arcgis/rest/services/DEEP_Trails_Set/FeatureServer/3",
      "status": "Supported",
      "evidence": "docs/archive/reports/STATE_AGENCY_REDISTRIBUTION_RIGHTS_2026-09-26.md"
    },
    {
      "state": "CT",
      "role": "parks supplement",
      "url": "https://ct-deep-gis-open-data-website-ctdeep.hub.arcgis.com/datasets/CTDEEP::deep-property-access-locations/explore",
      "status": "Supported",
      "evidence": "docs/archive/reports/STATE_AGENCY_REDISTRIBUTION_RIGHTS_2026-09-26.md"
    },
    {
      "state": "CT",
      "role": "forestry",
      "url": "https://services1.arcgis.com/FjPcSmEFuDYlIdKC/arcgis/rest/services/Connecticut_DEEP_Property/FeatureServer/0",
      "status": "Supported",
      "evidence": "docs/archive/reports/STATE_AGENCY_REDISTRIBUTION_RIGHTS_2026-09-26.md"
    },
    {
      "state": "CT",
      "role": "forestry supplement",
      "url": "https://services1.arcgis.com/FjPcSmEFuDYlIdKC/arcgis/rest/services/DEEP_Trails_Set/FeatureServer/3",
      "status": "Supported",
      "evidence": "docs/archive/reports/STATE_AGENCY_REDISTRIBUTION_RIGHTS_2026-09-26.md"
    },
    {
      "state": "CT",
      "role": "forestry supplement",
      "url": "https://ct-deep-gis-open-data-website-ctdeep.hub.arcgis.com/datasets/CTDEEP::deep-property-access-locations/explore",
      "status": "Supported",
      "evidence": "docs/archive/reports/STATE_AGENCY_REDISTRIBUTION_RIGHTS_2026-09-26.md"
    },
    {
      "state": "DE",
      "role": "parks",
      "url": "https://enterprise.firstmaptest.delaware.gov/arcgis/rest/services/Society/DE_State_Lands/MapServer/0",
      "status": "Unconfirmed",
      "evidence": "docs/archive/reports/STATE_AGENCY_REDISTRIBUTION_RIGHTS_2026-09-26.md"
    },
    {
      "state": "DE",
      "role": "parks supplement",
      "url": "https://enterprise.firstmaptest.delaware.gov/arcgis/rest/services/Transportation/DE_Multimodal/MapServer/28",
      "status": "Unconfirmed",
      "evidence": "docs/archive/reports/STATE_AGENCY_REDISTRIBUTION_RIGHTS_2026-09-26.md"
    },
    {
      "state": "DE",
      "role": "forestry",
      "url": "https://enterprise.firstmaptest.delaware.gov/arcgis/rest/services/Biota/DE_Forestry/MapServer/0",
      "status": "Unconfirmed",
      "evidence": "docs/archive/reports/STATE_AGENCY_REDISTRIBUTION_RIGHTS_2026-09-26.md"
    },
    {
      "state": "DE",
      "role": "forestry supplement",
      "url": "https://enterprise.firstmaptest.delaware.gov/arcgis/rest/services/Transportation/DE_Multimodal/MapServer/28",
      "status": "Unconfirmed",
      "evidence": "docs/archive/reports/STATE_AGENCY_REDISTRIBUTION_RIGHTS_2026-09-26.md"
    },
    {
      "state": "FL",
      "role": "parks",
      "url": "https://ca.dep.state.fl.us/arcgis/rest/services/OpenData/PARKS_BOUNDARIES/MapServer",
      "status": "Unconfirmed",
      "evidence": "docs/archive/reports/STATE_AGENCY_REDISTRIBUTION_RIGHTS_2026-09-26.md"
    },
    {
      "state": "FL",
      "role": "forestry",
      "url": "https://fgdl.org/zips/geospatial_data/current/state_forests_mar25.zip",
      "status": "Unconfirmed",
      "evidence": "docs/archive/reports/STATE_AGENCY_REDISTRIBUTION_RIGHTS_2026-09-26.md"
    },
    {
      "state": "FL",
      "role": "forestry supplement",
      "url": "https://cadev.dep.state.fl.us/arcgis/rest/services/OpenData/OGT/MapServer/3",
      "status": "Unconfirmed",
      "evidence": "docs/archive/reports/STATE_AGENCY_REDISTRIBUTION_RIGHTS_2026-09-26.md"
    },
    {
      "state": "GA",
      "role": "parks",
      "url": "https://data.georgiaspatial.org/data/statewide/dnr/fed_lands/dnr20a.html",
      "status": "Unconfirmed",
      "evidence": "docs/archive/reports/STATE_AGENCY_REDISTRIBUTION_RIGHTS_2026-09-26.md"
    },
    {
      "state": "GA",
      "role": "forestry",
      "url": "https://data.georgiaspatial.org/data/statewide/dnr/fed_lands/dnr20a.html",
      "status": "Unconfirmed",
      "evidence": "docs/archive/reports/STATE_AGENCY_REDISTRIBUTION_RIGHTS_2026-09-26.md"
    },
    {
      "state": "GA",
      "role": "forestry supplement",
      "url": "https://services6.arcgis.com/9QlSLDqa0P1cHLhu/ArcGIS/rest/services/Georgia_Conservation_Lands_23_proof_v2/FeatureServer/134",
      "status": "Unconfirmed",
      "evidence": "docs/archive/reports/STATE_AGENCY_REDISTRIBUTION_RIGHTS_2026-09-26.md"
    },
    {
      "state": "HI",
      "role": "parks",
      "url": "https://geodata.hawaii.gov/arcgis/rest/services/Infrastructure/MapServer/16",
      "status": "Unconfirmed",
      "evidence": "docs/archive/reports/STATE_AGENCY_REDISTRIBUTION_RIGHTS_2026-09-26.md"
    },
    {
      "state": "HI",
      "role": "parks supplement",
      "url": "https://geodata.hawaii.gov/arcgis/rest/services/Infrastructure/MapServer/31",